Name,Address(es),Adopted,NRHP,Description,Notes,Geocoded Address,City,State,Zip Code,Census Tract,Census Block,Census Block Group,neighborhood,Council District ,Police District,Longitude,Latitude,Location
Buffalo Lighthouse,1 Fuhrmann Boulevard,05/08/1986 12:00:00 AM,Listed,"The Buffalo Lighthouse, also called the Buffalo Main Light, was built in 1833 and deactivated in 1914. The 1961 effort to save the lighthouse was the starting point for the preservation movement in Buffalo.",,"1 Fuhrmann Blvd, Buffalo, NY, 14203",Buffalo,NY,14203,5,1040,1,Central,SOUTH,District A,-78.88762704477390,42.876829162886500,POINT (-78.88762704477386 42.876829162886494)
St. John the Baptist R.C. Church,62 Hertel Avenue,10/12/1978 12:00:00 AM,Eligible,St. John the Baptist R.C. Church was built from 1925 to 1927 and designed in the Italian Romanesque style by Oakley & Schallmo.,,"62 Hertel, Buffalo, NY, 14207",Buffalo,NY,14207,59,2006,2,Black Rock,NORTH,District D,-78.90419276960710,42.941419152957600,POINT (-78.90419276960705 42.941419152957565)
82 Allenhurst Road,82 Allenhurst Road,03/06/2018 12:00:00 AM,Listed,"82 Allenhurst Road, built in 1921 by developer Anthony Huck, is an exceptional example of a craftsman bungalow in the University Park “planned"" neighborhood.",,"82 Allenhurst Rd, Buffalo, NY, 14214",Buffalo,NY,14214,46.01,3003,3,University Heights,UNIVERSITY,District E,-78.82239417817880,42.95764211785390,POINT (-78.82239417817877 42.95764211785387)
Shea's Buffalo Theatre,642 Main Street,06/09/1977 12:00:00 AM,Listed,"Shea's Buffalo is a movie palace, now a performing arts theater, built from 1925 to 1926 and designed by Rapp & Rapp in a combination of Spanish and French Baroque and Rococo styles, with the interior design by Louis Comfort Tiffany.",,"642 Main St, Buffalo, NY, 14202",Buffalo,NY,14202,165,1020,1,Central,ELLICOTT,District B,-78.87256070227640,42.89147230107290,POINT (-78.87256070227642 42.89147230107289)
Birge Mansion,2 Symphony Circle,07/14/1977 12:00:00 AM,Listed,"The Birge Mansion was built in 1897 and designed in the Georgian Revival style by Little & Browne of Boston. It was the home of George K. Birge, founder and president of the Pierce Arrow Motor Company.",,"2 Symphony Cir, Buffalo, NY, 14201",Buffalo,NY,14222,67.01,1002,1,Elmwood Bryant,ELLICOTT,District B,-78.88180108038970,42.9030649600744,POINT (-78.88180108038968 42.9030649600744)
Parkside Lutheran Church,101 Linden Avenue,12/08/1992 12:00:00 AM,Undetermined,Parkside Lutheran Church was built from 1924 to 1925 and designed in the Tudor Gothic Revival style by Frank A. Spangenberg.,,"101 Linden Ave, Buffalo, NY, 14214",Buffalo,NY,14214,48,2012,2,North Park,DELAWARE,District D,-78.84721462997890,42.943290504014900,POINT (-78.84721462997885 42.943290504014854)
Engine No. 22,1522 Broadway,11/13/2018 12:00:00 AM,Eligible,"Engine No. 22 was built from 1890 to 1891 and designed in the Romanesque Revival style by August C. Esenwein. It is the city’s second oldest continually operating firehouse, and may be the oldest surviving Esenwein designed building in Buffalo.",,"1522 Broadway, Buffalo, NY, 14212",Buffalo,NY,14212,28,2001,2,Genesee-Moselle,FILLMORE,District C,-78.81863477090760,42.896384922654300,POINT (-78.81863477090764 42.896384922654306)
Polish Singing Circle Building,1168 Broadway,05/11/1978 12:00:00 AM,Eligible,The Polish Singing Circle Building was designed by Ladislaus Zawadzki. The Polish Singing Circle was organized in 1897 and occupied this building starting in 1916.,,"1168 Broadway, Buffalo, NY, 14212",Buffalo,NY,14212,27.02,3009,3,Broadway Fillmore,FILLMORE,District C,-78.83172693532540,42.894516716101700,POINT (-78.83172693532536 42.894516716101734)
Dellenbaugh Block,"163 Broadway, 167 Broadway",03/22/2005 12:00:00 AM,Eligible,"The Dellenbaugh Block is a series of four interconnected structures built from 1842 to 1922. Frederick Dellenbaugh, a prominent German immigrant, built the 1842 Federal Style house.",,"163 Broadway, Buffalo, NY, 14204",Buffalo,NY,14204,14.02,4012,4,Pratt-Willert,ELLICOTT,District B,-78.86717140563750,42.88684738729590,POINT (-78.86717140563752 42.88684738729591)
Bennett High School & All High Stadium,2837 Main Street,05/29/2018 12:00:00 AM,Eligible,Bennett High School is a public high school built from 1923 to 1925 and designed in a Georgian Revival style by the Associated Buffalo Architects. All High Stadium was built in 1928 and designed in a neoclassical style by Ernest Crimi.,,"2837 Main St, Buffalo, NY, 14214",Buffalo,NY,14214,45,2004,2,Central Park,MASTEN,District E,-78.83368181698960,42.94407559038500,POINT (-78.83368181698958 42.94407559038498)
Transfiguration R.C. Church,929 Sycamore Street,07/12/1994 12:00:00 AM,Eligible,Transfiguration R.C. Church was built in 1896 and designed in the Gothic Revival style by Carl Schmill.,,"929 Sycamore St, Buffalo, NY, 14212",Buffalo,NY,14212,27.02,4002,4,Broadway Fillmore,FILLMORE,District C,-78.83690929231870,42.898322005958500,POINT (-78.83690929231867 42.898322005958526)
Masten Avenue Armory,188 East North Street,05/29/2018 12:00:00 AM,Eligible,The Masten Avenue Armory is a New York Army National Guard facility built from 1932 to 1933 and designed in a Tudor Revival style by William E. Haugaard.,,"188 E North St, Buffalo, NY, 14209",Buffalo,NY,14209,31,3001,3,Fruit Belt,ELLICOTT,District B,-78.86147205516480,42.9022229431439,POINT (-78.86147205516475 42.9022229431439)
Colored Musicians Club,145 Broadway,09/13/1979 12:00:00 AM,Listed,"145 Broadway has been the home of the Colored Musicians Club, a historic jazz institution of national renown, since 1935. The building was constructed in 1910 and designed by Joseph Geigand.",,"145 Broadway, Buffalo, NY, 14203",Buffalo,NY,14203,165,1078,1,Central,ELLICOTT,District B,-78.86766498129090,42.886740000878100,POINT (-78.86766498129086 42.886740000878135)
Gethsemane Missionary Baptist Church,55 Grape Street,10/01/2019 12:00:00 AM,Undetermined,"Gethsemane Missionary Baptist Church (originally the St. Paul's Evangelical Lutheran Church) is a complex erected in phases from 1875 to 1989. After 1962, the church under Rev. Herbert V. Reid became Buffalo's most active in the fight for racial justice.",,"55 Grape St, Buffalo, NY, 14204",Buffalo,NY,14204,31,2012,2,Fruit Belt,ELLICOTT,District B,-78.85673666680230,42.8973571981292,POINT (-78.85673666680226 42.8973571981292)
St. Paul's Episcopal Cathedral,12 Church Street,04/14/1977 12:00:00 AM,Listed,"St. Paul's Episcopal Cathedral was built from 1849 to 1851 and designed in the Gothic Revival style by Richard Upjohn. Upjohn is said to have considered St. Paul's his best commission, and it is arguably Buffalo's first nationally noteworthy building.",,"12 Church St, Buffalo, NY, 14202",Buffalo,NY,14202,165,1062,1,Central,FILLMORE,District B,-78.87589346833640,42.88308408164200,POINT (-78.87589346833637 42.88308408164201)
Boarding House Restaurant,140 Seneca Street,06/27/1989 12:00:00 AM,Eligible,140 Seneca Street is a three-story brick Italianate commercial block built in about 1865.,,"140 Seneca St, Buffalo, NY, 14203",Buffalo,NY,14203,165,1107,1,Central,FILLMORE,District B,-78.87107894179150,42.87983106851620,POINT (-78.87107894179152 42.87983106851624)
Hook & Ladder Company No. 3,308 Spring Street,07/09/1981 12:00:00 AM,,N/A,Demolished (now part of 412 William),"308 Spring St, Buffalo, NY, 14204",Buffalo,NY,14204,14.02,4003,4,Pratt-Willert,ELLICOTT,District B,-78.85614290443790,42.8860683252893,POINT (-78.85614290443786 42.8860683252893)