Name,Address(es),Adopted,NRHP,Description,Notes,Geocoded Address,City,State,Zip Code,Census Tract,Census Block,Census Block Group,neighborhood,Council District ,Police District,Longitude,Latitude,Location
Connecticut Street Armory,781 Niagara Street,09/14/1978 12:00:00 AM,Listed,The Connecticut Street Armory is a New York Army National Guard facility built from 1897 to 1899 and designed in a Richardsonian Romanesque style by Williams Lansing with Isaac G. Perry.,,"781 Niagara, Buffalo, NY, 14213",Buffalo,NY,14213,70,3008,3,West Side,NIAGARA,District B,-78.8950024041102,42.904404176884400,POINT (-78.8950024041102 42.904404176884434)
Wilkeson-Storms House,771 Busti Avenue,10/13/2009 12:00:00 AM,,N/A,Demolished,"771 Busti Ave, Buffalo, NY, 14213",Buffalo,NY,14213,70,3005,3,West Side,NIAGARA,District B,-78.89814553270390,42.90420310487290,POINT (-78.89814553270385 42.90420310487285)
General Electric Tower,20 East Huron Street,05/15/2018 12:00:00 AM,Listed,"The General Electric Tower is among the most familiar and identifiable features of the Buffalo skyline. The 14 story, 294-foot tall office building was built from 1911 to 1912 and designed in the Beaux Arts style by Esenwein & Johnson.",,"20 E Huron St, Buffalo, NY, 14203",Buffalo,NY,14203,165,1033,1,Central,ELLICOTT,District B,-78.87224710464730,42.88847621946660,POINT (-78.87224710464733 42.88847621946663)
St. Vincent's Female Orphan Asylum Complex,"1313 Main Street, 1140 Ellicott Street",07/25/1989 12:00:00 AM,Undetermined,"The St. Vincent’s Female Orphan Asylum includes the Robinson-Squier House, built c. 1860; Orphanage, built from 1898 to 1899 and designed by Green & Wicks; G. Barrett Rich House, built c. 1890; and Gymnasium, built in 1935 and designed by George Dietel.",,"1313 Main St, Buffalo, NY, 14209",Buffalo,NY,14209,168,2008,2,Elmwood Bryant,ELLICOTT,District B,-78.86649326235990,42.909385615187200,POINT (-78.86649326235994 42.909385615187176)
Wood Row Houses,147 Woodlawn Avenue,09/10/1981 12:00:00 AM,,N/A,Demolished,"147 Woodlawn Ave, Buffalo, NY, 14208",Buffalo,NY,14208,168,4008,4,Masten Park,MASTEN,District E,-78.85934987269940,42.91383916612180,POINT (-78.85934987269938 42.91383916612179)
Franklin Square North,"556 Franklin Street, 558 Franklin Street, 564 Franklin Street",03/10/1977 12:00:00 AM,Listed,"Franklin Square North is a site consisting of the Phineas Marsh House, built in 1867 in the Italianate style; Sullivan Drullard House, built in 1862 in the Second Empire style, with a Romanesque addition built in the 1890s; and a rear carriage house.",,"556 Franklin St, Buffalo, NY, 14202",Buffalo,NY,14202,68,2002,2,Allentown,FILLMORE,District B,-78.87166133623490,42.90160466664890,POINT (-78.87166133623492 42.90160466664894)
Rev. J. Edward Nash Sr. House,36 Nash Street,02/20/2001 12:00:00 AM,Listed,"The Rev. J. Edward Nash Sr. House is a vernacular house built in 1893 and best associated with the Rev. Nash, pastor of the Michigan Street Baptist Church from 1892 to 1953. Nash lived in the house from 1925 to 1957.",,"36 Nash St, Buffalo, NY, 14204",Buffalo,NY,14204,14.02,4012,4,Pratt-Willert,ELLICOTT,District B,-78.86642403300380,42.88585012099920,POINT (-78.86642403300384 42.88585012099924)
Old County Hall,100 Franklin Street,04/14/1977 12:00:00 AM,Listed,Old City & County Hall is a historic city hall and courthouse built from 1871 to 1875 and designed in the Late Victorian Romanesque style by Andrew Jackson Warner. The four story granite building features a 270-foot central clock tower.,Includes only Old City & County Hall (not the extension),"100 Franklin St, Buffalo, NY, 14202",Buffalo,NY,14202,165,1069,1,Central,ELLICOTT,District B,-78.8772035540813,42.88444176207950,POINT (-78.8772035540813 42.88444176207951)
Old Post Office (ECC City Campus),70 Swan Street,01/12/1978 12:00:00 AM,Listed,"The Old Post Office was built from 1897 to 1901 and designed with Romanesque Revival, Chateauesque, and French Gothic features by James Knox Taylor. The building features a 244 foot tower and central light court.",,"70 Swan St, Buffalo, NY, 14203",Buffalo,NY,14203,165,1102,1,Central,FILLMORE,District B,-78.87277384587890,42.88142536381110,POINT (-78.87277384587888 42.88142536381108)
Marine Hospital (former UB Medical School),2211 Main Street,01/21/1992 12:00:00 AM,Eligible,The Marine Hospital was built in 1909 and designed in the Federal Style by James Knox Taylor.,,"2211 Main St, Buffalo, NY, 14214",Buffalo,NY,14214,52.01,3006,3,Fillmore-Leroy,MASTEN,District E,-78.8485314774116,42.93038360474270,POINT (-78.8485314774116 42.93038360474271)
Dun Building,110 Pearl Street,05/11/1978 12:00:00 AM,Listed,"The Dun Building is a 10 story office building built from 1894 to 1895 and designed in the Neoclassical style by Green & Wicks. Robert Graham Dunn, for whom the highrise was built, founded the R.G. Dun & Company, predecessor to Dun & Bradstreet.",,"110 Pearl North, Buffalo, NY, 14202",Buffalo,NY,14202,68,2001,2,Allentown,FILLMORE,District B,-78.87107843398520,42.899649241256100,POINT (-78.87107843398519 42.899649241256064)
St. Mary's R.C. Church Complex,"215 Broadway, 217 Broadway",02/14/1980 12:00:00 AM,Undetermined,"St. Mary’s Lyceum, all that remains of the St. Mary’s R.C. Church Complex, was built in 1909 and designed in a Neoclassical style. The architect is not known.",,"215 Broadway, Buffalo, NY, 14204",Buffalo,NY,14204,14.02,4010,4,Pratt-Willert,ELLICOTT,District B,-78.86514841762430,42.887291089071100,POINT (-78.86514841762427 42.887291089071134)
Buffalo Historical Society,25 Nottingham Court,07/12/1979 12:00:00 AM,Listed,"The Buffalo Historical Society, built from 1900 to 1901 and designed in a Neoclassical style by George Cary, was the only permanent building constructed for the Pan American Exposition.",No assessment address; Includes only Buffalo History Museum,"25 Nottingham, Buffalo, NY, 14216",Buffalo,NY,14216,54,1005,1,Parkside,DELAWARE,District D,-78.86115034874440,42.93895004173320,POINT (-78.86115034874435 42.93895004173319)
St. Vincent de Paul Rectory (Martin Hall),15 Eastwood Place,02/21/1995 12:00:00 AM,Undetermined,St. Vincent de Paul Rectory was built from 1913 to 1914 and designed in the Colonial Revival style by Max G. Beierl.,,"15 Eastwood Pl, Buffalo, NY, 14208",Buffalo,NY,14208,52.02,1003,1,Hamlin Park,MASTEN,District E,-78.85256202623930,42.92613720428160,POINT (-78.85256202623931 42.92613720428164)
Kensington High School,319 Suffolk Street,06/26/2018 12:00:00 AM,Eligible,"Kensington High School is a public high school built from 1934 to 1937 and designed in the Art Deco style by  Daniel G. McNeil. The school was funded by the Public Works Administration, a New Deal program established in 1933.",,"319 Suffolk St, Buffalo, NY, 14215",Buffalo,NY,14215,44.02,2000,2,Kenfield,UNIVERSITY,District E,-78.81039489621420,42.93109052358580,POINT (-78.81039489621416 42.93109052358578)
159 Swan Street,159 Swan Street,07/12/1979 12:00:00 AM,,N/A,Demolished; Includes only the original rowhouse site at the former 159 Swan,"159 Swan St, Buffalo, NY, 14203",Buffalo,NY,14203,165,1107,1,Central,FILLMORE,District B,-78.86969013403870,42.880768477157300,POINT (-78.86969013403872 42.880768477157254)
St. Francis de Sales R.C. Church,575 Humboldt Parkway,10/12/1978 12:00:00 AM,Listed,St. Francis de Sales R.C. Church was built from 1926 to 1927 and designed in an Italian Romanesque Revival style by Murphy & Olmsted with George J. Dietel.,,"575 Humboldt Pkwy, Buffalo, NY, 14208",Buffalo,NY,14208,33.01,2007,2,Hamlin Park,MASTEN,District E,-78.84377969730400,42.919182805524000,POINT (-78.84377969730403 42.919182805524045)
Little Harlem Hotel,494 Michigan Avenue,09/11/1980 12:00:00 AM,,N/A,Demolished,"494 Michigan Ave, Buffalo, NY, 14203",Buffalo,NY,14203,165,1078,1,Central,ELLICOTT,District B,-78.86781887065320,42.885777228025200,POINT (-78.86781887065315 42.885777228025155)
158 Swan Street,158 Swan Street,07/12/1979 12:00:00 AM,,N/A,Demolished,"158 Swan St, Buffalo, NY, 14203",Buffalo,NY,14203,165,1106,1,Central,FILLMORE,District B,-78.8696970240905,42.88088214543910,POINT (-78.8696970240905 42.88088214543912)
Fisherman's Wharf,64 West Chippewa Street,02/21/1989 12:00:00 AM,,N/A,Demolished,"64 W Chippewa St, Buffalo, NY, 14202",Buffalo,NY,14202,165,1023,1,Central,ELLICOTT,District B,-78.87532958743970,42.89044080052160,POINT (-78.87532958743967 42.89044080052158)
School 46/Elmwood Park,"149 Edward Street, 175 Edward Street",09/02/2008 12:00:00 AM,Listed,"School 46, built in 1888 and designed by H.H. Little, is the oldest continually operating public school in Buffalo.",,"149 Edward St, Buffalo, NY, 14201",Buffalo,NY,14201,68,3009,3,Allentown,FILLMORE,District B,-78.87684235889580,42.89616426823510,POINT (-78.87684235889583 42.89616426823511)
Lafayette Avenue Presbyterian Church,598 Lafayette Avenue,02/09/1978 12:00:00 AM,Listed,Lafayette Avenue Presbyterian Church was built from 1894 to 1896 and designed in the Romanesque Revival style by Lansing & Beierl. Bouck Street was renamed to Lafayette Avenue in honor of the church.,,"598 Lafayette Ave, Buffalo, NY, 14222",Buffalo,NY,14222,63.02,2006,2,Elmwood Bidwell,DELAWARE,District D,-78.87603630968710,42.920433832321600,POINT (-78.87603630968711 42.920433832321635)
Fosdick Masten High School,"186 East North Street, 161 Best Street, 180 East North Street",03/12/1981 12:00:00 AM,Listed,"Fosdick Masten High School, now known as City Honors School, was built from 1912 to 1914 and designed in the Beaux Arts style by Esenwein & Johnson.",,"186 E North St, Buffalo, NY, 14209",Buffalo,NY,14209,31,3002,3,Fruit Belt,ELLICOTT,District B,-78.86161900109040,42.90222309957750,POINT (-78.86161900109039 42.90222309957754)
Jefferson Street Shul,407 Jefferson Avenue,05/27/1997 12:00:00 AM,,N/A,Demolished,"407 Jefferson Ave, Buffalo, NY, 14206",Buffalo,NY,14206,15,2011,2,Broadway Fillmore,ELLICOTT,District C,-78.85386713696510,42.886050072234200,POINT (-78.85386713696506 42.886050072234234)
Stritzinger Building,871 Seneca Street,10/15/2019 12:00:00 AM,Undetermined,"The Stritzinger Building, a commercial block built by Anton Stritzinger as a saloon by 1893, is a prominent and familiar visual feature of the Hydraulics neighborhood.",,"871 Seneca St, Buffalo, NY, 14210",Buffalo,NY,14210,164,3038,3,Ellicott,FILLMORE,District A,-78.84511687195840,42.87463413531270,POINT (-78.84511687195844 42.87463413531271)
Calumet Building,233 Franklin Street,11/13/1990 12:00:00 AM,Listed,"The Calumet Building, built in 1906 and designed by Esenwein & Johnson, is the most exuberant example of glazed architectural terra cotta in Buffalo.",,"233 Franklin St, Buffalo, NY, 14202",Buffalo,NY,14202,165,1022,1,Central,ELLICOTT,District B,-78.87520041741130,42.89016740003880,POINT (-78.87520041741128 42.89016740003878)
William R. Heath House,76 Soldiers Place,03/17/2020 12:00:00 AM,Listed,The William R. Heath House was designed by Frank Lloyd Wright and built from 1905 to 1908.,,"76 Soldiers Pl, Buffalo, NY, 14222",Buffalo,NY,14222,63.02,3005,3,Elmwood Bidwell,DELAWARE,District D,-78.87508186410170,42.92575446564300,POINT (-78.87508186410165 42.92575446564298)
Walter V. Davidson House,57 Tillinghast Street,03/17/2020 12:00:00 AM,Listed,The Walter V. Davidson House was designed by Frank Lloyd Wright and built in 1908.,,"57 Tillinghast Pl, Buffalo, NY, 14216",Buffalo,NY,14216,54,4004,4,Parkside,DELAWARE,District D,-78.85453278495580,42.9422578686445,POINT (-78.85453278495581 42.9422578686445)
St. Mary's Seminary,125 Edward Street,03/10/1977 12:00:00 AM,Listed,"St. Mary's Seminary is a three and four story building with Federal and Italianate style detailing built in 1862, and occupied by the Le Couteulx St. Mary's Institute for Dead Mutes until 1899.",,"125 Edward St, Buffalo, NY, 14201",Buffalo,NY,14201,68,2009,2,Allentown,FILLMORE,District B,-78.87612467973020,42.896031537676000,POINT (-78.87612467973021 42.896031537676045)
341 Franklin Street,341 Franklin Street,10/30/2018 12:00:00 AM,Not eligible,341 Franklin Street is a mixed-use building constructed in about 1854.,,"341 Franklin St, Buffalo, NY, 14202",Buffalo,NY,14202,68,2012,2,Allentown,FILLMORE,District B,-78.87394253756610,42.89402854658850,POINT (-78.87394253756608 42.89402854658845)
Blessed Trinity R.C. Church,317 Leroy Avenue,01/13/1977 12:00:00 AM,Listed,"Blessed Trinity Roman Catholic Church, built from 1923 to 1928 and designed by Schmill & Gould, may be the finest example of Lombard-Romanesque architecture in North America.",,"317 Leroy Ave, Buffalo, NY, 14214",Buffalo,NY,14214,40.01,2005,2,Fillmore-Leroy,MASTEN,District E,-78.83383361910730,42.93275181017170,POINT (-78.83383361910727 42.93275181017165)
Fire Engine Company No. 28,1170 Lovejoy Street,04/10/1980 12:00:00 AM,Listed,Engine No. 28 is a firehouse built in 1897 and designed in the Queen Anne style by Frederick Mohr.,,"1170 Lovejoy, Buffalo, NY, 14206",Buffalo,NY,14206,24,3002,3,Lovejoy,LOVEJOY,District C,-78.80486829748290,42.88981089262680,POINT (-78.80486829748293 42.88981089262681)
Guaranty Building (Prudential Building),140 Pearl Street,03/30/1977 12:00:00 AM,Listed,"The Guaranty Building is a skyscraper built from 1895 to 1896 and designed in the Sullivanesque style by Louis Sullivan and Dankmar Adler. The 13 story office building is among the earliest steel-supported, curtain-walled buildings ever built.",,"140 Pearl North, Buffalo, NY, 14202",Buffalo,NY,14202,68,2001,2,Allentown,FILLMORE,District B,-78.87096367809130,42.90000521879880,POINT (-78.87096367809127 42.90000521879879)
Holy Mother of the Rosary Cathedral,182 Sobieski Street,06/12/1986 12:00:00 AM,Eligible,Holy Mother of the Rosary Cathedral was built from 1900 to 1906 and designed in a Gothic Revival style by Sidney Woodruff. It is now Masjid Zakariya.,,"182 Sobieski St, Buffalo, NY, 14212",Buffalo,NY,14212,27.02,3004,3,Broadway Fillmore,FILLMORE,District C,-78.83274569780230,42.89948181076060,POINT (-78.83274569780232 42.89948181076063)
Lafayette Hotel,391 Washington Street,04/12/1979 12:00:00 AM,Listed,"The Lafayette Hotel is a seven-story hotel built in phases between 1902 and 1926 and designed in the French Renaissance style by Bethune, Bethune, & Fuchs. Louise Blanchard Bethune was the first registered female architect in the U.S.",,"391 Washington St, Buffalo, NY, 14203",Buffalo,NY,14203,165,1073,1,Central,ELLICOTT,District B,-78.87351756911310,42.8847420757262,POINT (-78.87351756911313 42.8847420757262)
Park Lane Condominiums,771 Lafayette Avenue,09/12/2006 12:00:00 AM,Listed,"The Park Lane Condominiums, originally called the Parke Apartments, is a ten-story building built from 1924 to 1925 and designed in the Second Renaissance Revival style by H.L. Stevens & Company.",,"771 Lafayette Ave, Buffalo, NY, 14222",Buffalo,NY,14222,169,1000,1,Elmwood Bidwell,DELAWARE,District D,-78.86897714828020,42.92048025892750,POINT (-78.86897714828021 42.92048025892746)
Darwin Martin Complex,"125 Jewett Parkway, 143 Jewett Parkway, 118 Summitt Avenue",03/10/1977 12:00:00 AM,Listed,The Darwin D. Martin House Complex was built between 1903 and 1905 and designed by Frank Lloyd Wright. The Martin House Complex is among the most important works of Wright's Prairie School period.,,"125 Jewett Ave, Buffalo, NY, 14214",Buffalo,NY,14214,40.01,4003,4,Fillmore-Leroy,MASTEN,District E,-78.83960716230030,42.93395215071970,POINT (-78.83960716230033 42.93395215071965)
Burgard Vocational High School,368 Kensington Avenue,11/13/2018 12:00:00 AM,Not eligible,Burgard Vocational High School was built from 1929 to 1930 and designed in an Art Deco style with Collegiate Gothic elements by Ernest Crimi.,,"368 Kensington Ave, Buffalo, NY, 14214",Buffalo,NY,14214,40.01,4011,4,Fillmore-Leroy,MASTEN,District E,-78.83708889537770,42.928513822846400,POINT (-78.83708889537766 42.928513822846405)
Grover Cleveland High School,100 Fourteenth Street,06/12/2018 12:00:00 AM,Eligible,"Grover Cleveland High School was built from 1913 to 1914 and designed in a Georgian Revival style by architect Herman W. Hoefer. It was originally built as the Buffalo State Normal School, and taken over by the Buffalo Board of Education in 1931.",,"100 14th St, Buffalo, NY, 14213",Buffalo,NY,14213,69.02,1010,1,West Side,NIAGARA,District B,-78.88388498291920,42.90319821483960,POINT (-78.88388498291923 42.90319821483956)
Wood Row Houses,29 Emerson Place,09/10/1981 12:00:00 AM,Listed,"Built in 1894, this is part of a series of wood frame row house developments built in Master Park, the only Buffalo neighborhood with a significant concentration of such buildings.",,"29 Emerson Pl, Buffalo, NY, 14209",Buffalo,NY,14209,168,4019,4,Masten Park,MASTEN,District E,-78.86152260196860,42.913143046934900,POINT (-78.86152260196855 42.913143046934934)
St. Vincent de Paul R.C. Church,2021 Main Street,11/10/1977 12:00:00 AM,Undetermined,"St. Vincent de Paul R.C. Church was built from 1924 to 1926 and designed in a Byzantine/Romanesque style by Thomas, Perry, & McMullen.",,"2021 Main St, Buffalo, NY, 14208",Buffalo,NY,14208,52.02,1002,1,Hamlin Park,MASTEN,District E,-78.85260992973610,42.92652453205020,POINT (-78.85260992973606 42.92652453205022)
St. John's Grace Episcopal Church,13 Bidwell Parkway,02/09/1978 12:00:00 AM,Listed,"St. John's Grace Episcopal Church was built from 1925 to 1927 and designed in the English Perpendicular Gothic style by Mayers, Murray, & Philip with Bertram Grosvenor Goodhue.",,"13 Bidwell Pkwy, Buffalo, NY, 14222",Buffalo,NY,14222,63.01,2006,2,Elmwood Bidwell,DELAWARE,District D,-78.88082640504990,42.920597896999000,POINT (-78.88082640504986 42.920597896999006)
St. Louis R.C. Church,782 Main Street,01/12/1978 12:00:00 AM,Listed,St. Louis R.C. Church was built from 1886 to 1889 and designed in the Gothic style by Schikel & Ditmars. The 245 foot tower is intended to recall the tower of the Cathedral of Cologne.,,"782 Main St, Buffalo, NY, 14202",Buffalo,NY,14202,68,2007,2,Allentown,FILLMORE,District B,-78.87131788786550,42.89523178796330,POINT (-78.87131788786554 42.89523178796326)
Wood Row Houses,"75, 77, 79, & 81 Woodlawn Avenue",09/10/1981 12:00:00 AM,Listed,"Built in 1897, this is part of a series of wood frame row house developments built in Master Park, the only Buffalo neighborhood with a significant concentration of such buildings.",,"75 Woodlawn East, Buffalo, NY, 14211",Buffalo,NY,14211,35,3002,3,MLK Park,FILLMORE,District C,-78.82483006525550,42.91355195859970,POINT (-78.82483006525547 42.91355195859974)
Wood Row Houses,1335 Michigan Avenue,09/10/1981 12:00:00 AM,,N/A,Demolished,"1335 Michigan Ave, Buffalo, NY, 14209",Buffalo,NY,14209,168,4023,4,Masten Park,ELLICOTT,District B,-78.86237661937110,42.909658108466800,POINT (-78.86237661937112 42.909658108466814)
New York Central Terminal,495 Paderewski Drive,02/08/1979 12:00:00 AM,Listed,Buffalo Central Terminal is a 17-story former railroad station built from 1925 to 1929 and designed in the Art Deco style by Fellheimer & Wagner. It ceased operations as a railroad station in 1979.,Includes only the Central Terminal Tower and Concourse,"495 Paderewski Dr, Buffalo, NY, 14212",Buffalo,NY,14212,16,2015,2,Broadway Fillmore,FILLMORE,District C,-78.83167240172690,42.88966902367530,POINT (-78.83167240172685 42.88966902367533)
St. Andrew's Evangelical Lutheran Church,"175 Sherman Street, 212 Peckham Street",03/12/1981 12:00:00 AM,Listed,St. Andrew's Evangelical Lutheran Church was built from 1884 to 1885 and designed by L. Saenger.,,"175 Sherman St, Buffalo, NY, 14212",Buffalo,NY,14212,15,2020,2,Broadway Fillmore,FILLMORE,District C,-78.84685498850840,42.88852651458530,POINT (-78.84685498850841 42.88852651458532)
McKinley Monument,5 Niagara Square,05/12/1977 12:00:00 AM,Listed,"The McKinley Monument is a 96-foot tall obelisk dedicated in 1907 to the memory of President William McKinley, who was fatally shot at the Pan American Exposition in 1901. It was conceptualized by Daniel H. Burnham and designed by Carrère & Hastings.",,"5 Niagara Sq, Buffalo, NY, 14202",Buffalo,NY,14202,165,1054,1,Central,ELLICOTT,District B,-78.87888185839240,42.886374472565,POINT (-78.87888185839238 42.886374472565)
Engine No. 26,693 Tonawanda Street,06/26/2018 12:00:00 AM,Eligible,"Engine No. 26 is a firehouse built from 1894 to 1895 and designed in the Chateauesque style by Frederick W. Humble. Robert B. Howard, Buffalo's first African American firefighter and Fire Commissioner, served as captain of Engine No. 26 from 1960 to 1966.",,"693 Tonawanda St, Buffalo, NY, 14207",Buffalo,NY,14207,57,2001,2,Riverside,NORTH,District D,-78.90280763968270,42.947920867973200,POINT (-78.90280763968269 42.947920867973245)
Gates Circle Fountain,198 Soldiers Circle,03/10/1977 12:00:00 AM,Listed,"The Gates Circle Fountain, designed by E.B. Green, was erected from 1902 to 1903 in the circle known up to that point as Chapin Place. The fountain was funded by Mrs. Charles Pardee in honor of her parents, Mr. & Mrs. George B. Gates.",,"198 Soldiers Pl, Buffalo, NY, 14209",Buffalo,NY,14209,63.02,3001,3,Elmwood Bidwell,DELAWARE,District D,-78.87266439165790,42.925081234214100,POINT (-78.87266439165793 42.925081234214105)
Breckenridge Street Church (First Presbyterian Church of Black Rock),44 Breckenridge Street,09/29/1992 12:00:00 AM,Listed,"The Breckenridge Street Church, built in 1827, is an outstanding example of the Federal style, rare in Buffalo, and the only Federal church surviving in Buffalo.",,"44 Breckenridge St, Buffalo, NY, 14213",Buffalo,NY,14213,61,1018,1,Upper West Side,NIAGARA,District D,-78.90009889870080,42.917240438509700,POINT (-78.90009889870083 42.917240438509715)
Concrete Central Elevator,175 Buffalo River,07/10/2018 12:00:00 AM,Listed,"Concrete Central Elevator, built from 1915 to 1917 and designed by Harry R. Wait of the Monarch Engineering Company, is Buffalo's largest grain elevator and was the largest in the world when it was completed.",,"175 Buffalo St, Buffalo, NY, 14220",Buffalo,NY,14220,2,4000,4,Hopkins-Tifft,LOVEJOY,District A,-78.83025742915970,42.85722489209120,POINT (-78.83025742915972 42.85722489209115)
Great Northern Elevator & Pillsbury Mill,8 City Ship Canal,04/10/1990 12:00:00 AM,Eligible,"The Great Northern Elevator, built in 1897 and designed by engineer Max Toltz, is an outstanding example of an intermediate steel grain elevator, and is believed to be the sole surviving ""brick box"" elevator in North America.",,8 CITY SHIP CANAL,Buffalo,NY,14203,5,1046,1,Central,SOUTH,District A,-78.87256762757560,42.86629303508390,POINT (-78.87256762757558 42.86629303508388)
Ford Motor Company Fuhrmann Plant,901 Fuhrmann Boulevard,04/16/2019 12:00:00 AM,Eligible,The Ford Motor Company Fuhrmann Plant is an automobile assembly plant built from 1930 to 1931 and designed by Albert Kahn & Associates. About two million automobiles were made at the plant prior to its 1958 closure.,,"901 Fuhrmann Blvd, Buffalo, NY, 14203",Buffalo,NY,14203,1.10,3023,3,Central,SOUTH,District A,-78.8658630114803,42.85390550265790,POINT (-78.8658630114803 42.85390550265791)
The Church of the Good Shepard,96 Jewett Parkway,11/10/1977 12:00:00 AM,Listed,The Church of the Good Shepard was built from 1887 to 1888 and designed in the Richardsonian Romanesque style by Marling & Burdett.,,"96 Jewett Ave, Buffalo, NY, 14214",Buffalo,NY,14214,40.01,4004,4,Fillmore-Leroy,MASTEN,District E,-78.84063564900610,42.93407048283670,POINT (-78.84063564900612 42.93407048283674)
Wood Row Houses,"210, 214, & 218 Glenwood Avenue",09/10/1981 12:00:00 AM,,N/A,Demolished,"210 Glenwood Ave, Buffalo, NY, 14208",Buffalo,NY,14208,168,4010,4,Masten Park,MASTEN,District E,-78.85749311135400,42.91245494213300,POINT (-78.85749311135399 42.91245494213302)
Central Park United Methodist Church,216 Beard Avenue,02/09/1978 12:00:00 AM,Undetermined,The Central Park United Methodist Church was built from 1921 to 1923 and designed in the Perpendicular Gothic style by Charles Bolton & Sons.,,"216 Beard Ave, Buffalo, NY, 14214",Buffalo,NY,14214,45,4007,4,Central Park,DELAWARE,District D,-78.83666754824900,42.94345303676740,POINT (-78.83666754824898 42.94345303676739)
Durham Memorial AME Zion Church,170 East Eagle Street,01/11/1979 12:00:00 AM,Listed,"The Durham Memorial African Methodist Episcopal Zion Church was built in 1922 and designed by Louis Greenstein. Founded as St. Luke's AME Zion Church, it is the oldest surviving building associated with the Buffalo AME Zion congregations.",,"170 E Eagle St, Buffalo, NY, 14204",Buffalo,NY,14204,14.02,3006,3,Pratt-Willert,ELLICOTT,District B,-78.86835746730890,42.88323139896630,POINT (-78.86835746730894 42.88323139896633)
Near-Lewis House,1029 West Avenue,04/02/2019 12:00:00 AM,Undetermined,"The Near-Lewis House, built in about 1865, is a one story, cross gabled, vernacular workers cottage designed with Italianate style elements.",,"1029 West, Buffalo, NY, 14213",Buffalo,NY,14213,61,1023,1,Upper West Side,NIAGARA,District D,-78.89701278385270,42.918230337213700,POINT (-78.89701278385269 42.918230337213735)
Riverside High School,51 Ontario Street,06/26/2018 12:00:00 AM,Eligible,Riverside High School is a public high school built from 1928 to 1930 and designed in a neoclassicial style by F.J. & W.A. Kidd.,,"51 Ontario St, Buffalo, NY, 14207",Buffalo,NY,14207,57,2005,2,Riverside,NORTH,District D,-78.90641028743910,42.946797476087900,POINT (-78.90641028743907 42.946797476087916)
Albright-Knox Art Gallery,2182 Delaware Avenue,11/10/1977 12:00:00 AM,Listed,"The Albright Knox Art Gallery is an art museum built from 1890 to 1905 and designed in a Neoclassical style (modeled after the Erectheum) by Edward B. Green, with a 1962 addition designed in the Modernist style by Gordon Bunshaft.",Includes only the AKAG site,"2182 Delaware Ave, Buffalo, NY, 14216",Buffalo,NY,14216,54,2000,2,Parkside,NORTH,District D,-78.86808700678330,42.943543831629100,POINT (-78.86808700678333 42.943543831629086)
